{
  "$schema": "../../release.schema.json",
  "family": "backend-api",
  "version": "1.1.0",
  "schema": "backend-api/1.1.0/openapi.json",
  "schemaSha256": "sha256:3f29b7b0d1c9e2b68fc20e6a15a22046f5401326f907a469a8201e931624373d",
  "reviewedAt": "2026-09-07",
  "conformance": [
    "conformance/backend-api/1.1.0/cases.json"
  ],
  "producerTests": [
    "tests/contracts/test_backend_api.py",
    "tests/backend/test_cloud_documents.py",
    "tests/backend/test_identity.py",
    "tests/backend/test_publications.py"
  ],
  "consumerTests": [
    "tests/contracts/backend-api.test.ts",
    "tests/creator/publication-api.test.ts",
    "tests/market/market-api.test.ts"
  ],
  "implementations": [
    "typescript",
    "python"
  ]
}
