{
  "$schema": "../../release.schema.json",
  "family": "resource-package",
  "version": "1.0.0",
  "schema": "resource-package/1.0.0/schema.json",
  "schemaSha256": "sha256:fb8df45ac343f870e09579011591e315a758b014638de855243055e156203735",
  "reviewedAt": "2026-08-31",
  "conformance": [
    "conformance/resource-package/1.0.0/cases.json",
    "conformance/resource-package/1.0.0/archive-cases.json",
    "conformance/resource-package/1.0.0/digest-cases.json",
    "conformance/resource-package-version/1.0.0/cases.json"
  ],
  "producerTests": [
    "tests/creator/workspace-prototype.test.ts"
  ],
  "consumerTests": [
    "tests/player/resource-package-repository.test.ts",
    "tests/backend/test_publications.py"
  ],
  "implementations": ["typescript", "python"]
}
