{
  "$schema": "../../release.schema.json",
  "family": "system-package",
  "version": "1.0.0",
  "schema": "system-package/1.0.0/schema.json",
  "schemaSha256": "sha256:8f032f168646d412a364c34bb0da7877e9dafa537b666911aef3e021bb1ca8f3",
  "reviewedAt": "2026-08-31",
  "conformance": [
    "conformance/system-package/1.0.0/cases.json"
  ],
  "producerTests": [
    "tests/player/system-package-cli.test.ts"
  ],
  "consumerTests": [
    "tests/player/system-package-ingress.test.ts",
    "tests/contracts/test_system_package.py"
  ],
  "implementations": ["typescript", "python"]
}
