{
  "$schema": "../../release.schema.json",
  "family": "tabletop-document",
  "version": "1.0.0",
  "schema": "tabletop-document/1.0.0/schema.json",
  "schemaSha256": "sha256:5554f320a9783e2884f9fdae165f801a38833771d9185f2a733b864d661835a7",
  "reviewedAt": "2026-08-31",
  "conformance": [
    "conformance/tabletop-document/1.0.0/cases.json"
  ],
  "producerTests": [
    "tests/creator/tabletop-document-repository.test.ts"
  ],
  "consumerTests": [
    "tests/contracts/tabletop-document.test.ts",
    "tests/contracts/test_tabletop_document.py"
  ],
  "implementations": ["typescript", "python"]
}
